{
  "confidence_score": {
    "bucket": "medium",
    "components": [
      {
        "contribution": 34.1184,
        "data_sufficient": true,
        "max_value": 1.0,
        "name": "trend_alignment",
        "raw_value": 0.853,
        "reasoning": "1h pct=0.771%, 4h pct=1.512%, raw agreement=0.853.",
        "weight": 0.4
      },
      {
        "contribution": 25.925,
        "data_sufficient": true,
        "max_value": 1.0,
        "name": "volatility_suitability",
        "raw_value": 0.8642,
        "reasoning": "daily_vol=48.2%, hourly_atr=0.28%, raw suitability=0.864.",
        "weight": 0.3
      },
      {
        "contribution": 12.0,
        "data_sufficient": true,
        "max_value": 1.0,
        "name": "structural_clarity",
        "raw_value": 0.4,
        "reasoning": "regime=range, raw clarity=0.400.",
        "weight": 0.3
      }
    ],
    "penalties": [],
    "schema_version": "0.1.0",
    "strategy_version_ref": "v0.1.0",
    "total_score": 72.0434
  },
  "rejection_reason": null,
  "risk_plan": {
    "direction": "long",
    "entry_zone": "3451.40000000",
    "invalidation_criteria": [
      "close < stop_loss (3420.00000000)",
      "regime change to chop or manipulation_probable",
      "1h close breaks swing low (3420.00000000)"
    ],
    "max_intended_holding_period": "1h",
    "notes": "TP1 typically used for partial exit; TP2 and TP3 are runner targets. Adjust position sizing per account risk rules; this plan is structural, not sized.",
    "risk_reward_expectations": [
      {
        "level": 1,
        "r_multiple": 1.0
      },
      {
        "level": 2,
        "r_multiple": 2.0
      },
      {
        "level": 3,
        "r_multiple": 3.0
      }
    ],
    "schema_version": "0.1.0",
    "stop_loss": "3420.00000000",
    "strategy_version_ref": "v0.1.0",
    "take_profit_plan": [
      {
        "level": 1,
        "price": "3482.80000000",
        "r_multiple": 1.0
      },
      {
        "level": 2,
        "price": "3514.20000000",
        "r_multiple": 2.0
      },
      {
        "level": 3,
        "price": "3545.60000000",
        "r_multiple": 3.0
      }
    ]
  },
  "schema_version": "0.1.0",
  "scored_at": "2026-06-21T12:00:00.000000Z",
  "snapshot_ref": "specs/002-data-layer/fixtures/eth-perp-snapshot.json"
}
